{
  "schema": "hitobashira.handoff/v1",
  "run_id": "20261011T105518Z-4a3846",
  "seq": 3,
  "from_role": "verifier",
  "to_role": "coordinator",
  "prev_state": "OBSERVED",
  "state": "VERIFIED",
  "created_at": "2026-10-11T19:55:21.833+09:00",
  "artifacts": [
    {
      "path": "verdict/verify.json",
      "sha256": "aa0311c33fac45dd13ce9f99bbc4212966c8fd9bd02d75f29d68fad4ed68db95",
      "kind": "verdict"
    },
    {
      "path": "verdict/compare.json",
      "sha256": "080bf72823e837b34210d6df15c0a74e2abef337ce793d519893f18f0ddb0127",
      "kind": "verdict"
    }
  ],
  "prev_handoff_sha256": "ca174ffe75cdbacb9f0d7fcb119e2e50b09afef7d81ea79da6b0bfcfabd7dc45",
  "verify_lock": {
    "path": "verdict/verify.json",
    "sha256": "aa0311c33fac45dd13ce9f99bbc4212966c8fd9bd02d75f29d68fad4ed68db95",
    "locked_at": "2026-10-11T19:55:21.832+09:00"
  }
}
